{"action_interface":{"actions":["q_supply_missing_attribute"],"authorization_logic_performed":false,"construction_rule":"Copy the frozen original request byte-identically except for inserting exactly one subject Attribute (Category access-subject, AttributeId urn:oasis:names:tc:xacml:2.0:conformance-test:some-attribute, DataType xsd:string) carrying the world-specific value. No authorization logic is performed by the wrapper.","unit_cost":1},"execution_inputs_id":"PC-XACML-S3PLUS-v1-exec","freeze_order":["F000","F100","F010","F001","F110","F101","F011","F111"],"sources":{"commit":"3cc0e988e1639da48184434cd5c918102ff5b499","fixture":"pdp-testutils/src/test/resources/conformance/others/StatusDetail.MissingAttributeDetail/","implementation":"AuthzForce Core CE","release":"21.2.0","standard":"OASIS XACML 3.0","tag":"release-21.2.0"},"target_semantics":{"rule":"Use the canonical XACML Decision returned by the frozen PDP on each complete request world. No expected per-world outcome is stated here; outcomes enter only via parsed PDP responses in the Phase-2 target audit."},"worlds":{"x_nonpermit":{"missing_attribute_value":"not-riddle-me-this"},"x_permit":{"missing_attribute_value":"riddle me this"}}}
